{
  "id": "AV-13",
  "family": "delegated-authority",
  "profile": "snapshot",
  "invariant": "INV-04",
  "description": "Completed-action no-reversal (AV-05's dual): a protected action legitimately completed before revocation must NOT be reversed after the revocation — exercises the INV-04 'no reversal of completed actions' boundary rather than merely asserting it.",
  "rule": {
    "id": "INV-04_no_reversal_completed",
    "name": "INV-04_no_reversal_completed",
    "description": "A revocation invalidates unexercised derived authority but does not reverse actions that legitimately completed before it",
    "category": "security",
    "conditions": [
      { "expr": { "gte": [{ "epoch_ms": { "field": "completion_t" } }, { "epoch_ms": { "field": "revocation_t" } }] } }
    ],
    "conditionLogic": "AND",
    "action": {
      "decision": "DENY",
      "reason": "action was unexercised at revocation time and must not proceed (INV-04)"
    },
    "priority": 1,
    "enabled": true
  },
  "attack": { "completion_t": "2026-01-01T02:00:00Z", "revocation_t": "2026-01-01T01:00:00Z" },
  "legal": { "completion_t": "2026-01-01T00:30:00Z", "revocation_t": "2026-01-01T01:00:00Z" },
  "attribution": {
    "originating_task": "T-exec-0905",
    "authority_provenance": "P→A→B→C",
    "violation_hop": "P→A",
    "requested_action": "reverse(completed-action)",
    "effective_authority": "completed before revocation (no reversal)",
    "reason": "NO_REVERSAL_OF_COMPLETED_ACTION"
  }
}
