{
  "id": "AV-05",
  "family": "delegated-authority",
  "profile": "snapshot",
  "invariant": "INV-04",
  "description": "Revoked ancestor: P→A→B→C where C holds unexercised derived authority. P revokes the authorization granted to A; C then attempts to exercise the previously delegated authority.",
  "rule": {
    "id": "INV-04_enforcement_boundary_revocation",
    "name": "INV-04_enforcement_boundary_revocation",
    "description": "Authority derived solely from a revoked upstream authorization must not be exercised after the revocation",
    "category": "security",
    "conditions": [
      { "expr": { "gt": [{ "epoch_ms": { "field": "request_t" } }, { "epoch_ms": { "field": "revocation_t" } }] } }
    ],
    "conditionLogic": "AND",
    "action": {
      "decision": "DENY",
      "reason": "derived authority exercised after upstream revocation (INV-04)"
    },
    "priority": 1,
    "enabled": true
  },
  "attack": {
    "revocation_t": "2026-01-01T01:00:00Z",
    "request_t": "2026-01-01T02:00:00Z"
  },
  "legal": {
    "revocation_t": "2026-01-01T01:00:00Z",
    "request_t": "2026-01-01T00:30:00Z"
  },
  "attribution": {
    "originating_task": "T-delegate-0905",
    "authority_provenance": "P→A→B→C",
    "violation_hop": "P→A",
    "requested_action": "exercise(derived-authority)",
    "effective_authority": "revoked (P→A revoked)",
    "reason": "ENFORCEMENT_BOUNDARY_REVOCATION"
  }
}
